section,item,status,note
이번 주 수행 내용,answer 체크리스트 기반 기초 자료 작성,완료,운영 개요 및 템플릿 초안 포함
이번 주 수행 내용,governance 문서 및 템플릿 정리,완료,공통 문서 체계 정비
이번 주 수행 내용,미착수 9건 우선순위 재정리,완료,초기 대응 과제 명확화
주요 정량 결과,전체 체크리스트 항목 수,34,관리 대상 전체
주요 정량 결과,진행중 항목 수,25,핵심 개선 과제 진행중
주요 정량 결과,미착수 항목 수,9,우선순위 재검토 필요
실패 및 회귀 사례,RG-INIT-001 / 회귀 테스트셋 부재,진행중,운영 통제 문서 정리 필요
실패 및 회귀 사례,GF-INIT-001 / 생성 실패 분리 관리 공백,미착수,케이스북 운영 필요
차주 실행 과제,평가셋 초안 보강,미착수,실제 운영 질의 반영
차주 실행 과제,검색 실패 코드 실제 샘플 축적,미착수,원인별 개선 연결
차주 실행 과제,생성 실패 케이스북 실제 샘플 입력,미착수,프롬프트 개선 근거 확보
차주 실행 과제,회귀 테스트 최소본 작성,미착수,배포 전 통제 가능 상태 확보
